"TITLE","AUTHORS","SUBJECT","DESCRIPTION","PUBLISHER","AVAILABILITY","RESEARCH_ORG","SPONSORING_ORG","CONTRIBUTING_ORG","PUBLICATION_COUNTRY","PUBLICATION_DATE","LANGUAGE","RESOURCE_TYPE","TYPE_QUALIFIER","RELATION","COVERAGE","FORMAT","IDENTIFIER","REPORT_NUMBER","DOE_CONTRACT_NUMBER","OTHER_IDENTIFIER","DOI","RIGHTS","ENTRY_DATE","OSTI_IDENTIFIER","CITATION_URL","PURL_URL","JOURNAL_NAME","JOURNAL_ISSUE","JOURNAL_VOLUME"
"[sup 2]H induced reactions on [sup 8]Li and primordial nucleosynthesis","Balbes, M J; Farrell, M M; Boyd, R N; Gu, X; Hencheck, M; Kalen, J D; Mitchell, C A; Kolata, J J; Lamkin, K; Smith, R; Tighe, R; Ashktorab, K; Becchetti, F D; Brown, J; Roberts, D; Wang, T; Humphreys, D; Vourvopoulos, G; Islam, M S","73 NUCLEAR PHYSICS AND RADIATION PHYSICS; LITHIUM 8 TARGET; DEUTERON REACTIONS; NUCLEOSYNTHESIS; BERYLLIUM 9; CROSS SECTIONS; GROUND STATES; LITHIUM 7; NEUTRONS; TRITIUM; ALKALI METAL ISOTOPES; ALKALINE EARTH ISOTOPES; BARYONS; BERYLLIUM ISOTOPES; BETA DECAY RADIOISOTOPES; BETA-MINUS DECAY RADIOISOTOPES; CHARGED-PARTICLE REACTIONS; ELEMENTARY PARTICLES; ENERGY LEVELS; EVEN-ODD NUCLEI; FERMIONS; HADRONS; HYDROGEN ISOTOPES; ISOTOPES; LIGHT NUCLEI; LITHIUM ISOTOPES; NUCLEAR REACTIONS; NUCLEI; NUCLEONS; ODD-EVEN NUCLEI; RADIOISOTOPES; STABLE ISOTOPES; SYNTHESIS; TARGETS; YEARS LIVING RADIOISOTOPES; 663440* - D-, T-, & He-induced Reactions & Scattering- (1992-); 663520 - Nuclear Mass Ranges- A=6-19- (1992-)","Cross sections for the [sup 8]Li([ital d],[ital n])[sup 9]Be (ground state) and [sup 8]Li([ital d],[ital t])[sup 7]Li reactions, both important to primordial nucleosynthesis in the inhomogeneous models, have been measured using a radioactive beam technique. The cross section for the former reaction is found to be small, so it is important only for synthesis of [sup 9]Be. The cross section for the latter reaction, however, is found to be large enough to destroy significant quantities of [sup 8]Li, and thus could affect predictions of primordial nucleosynthesis yields.","","","","","","United States","1993-12-13T00:00:00Z","English","Journal Article","","Journal Name: Physical Review Letters; (United States); Journal Volume: 71:24","","Medium: X; Size: Pages: 3931-3934","","","W-7405-ENG-48","Journal ID: ISSN 0031-9007; CODEN: PRLTAO; TRN: 94-005354","10.1103/PhysRevLett.71.3931","","2009-12-16T00:00:00Z","5262042","https://www.osti.gov/biblio/5262042","","Physical Review Letters; (United States)","","71:24"
"Accelerative effect of wear on corrosion of high-alloy stainless steel","Jiang, X X; Li, S Z; Tao, D D; Yang, J X","36 MATERIALS SCIENCE; STAINLESS STEEL-18-8; CORROSION; WEAR; SLIDING FRICTION; SULFURIC ACID; ALLOYS; AUSTENITIC STEELS; CHEMICAL REACTIONS; CHROMIUM ALLOYS; CHROMIUM-NICKEL STEELS; CORROSION RESISTANT ALLOYS; FRICTION; HEAT RESISTANT MATERIALS; HEAT RESISTING ALLOYS; HIGH ALLOY STEELS; HYDROGEN COMPOUNDS; INORGANIC ACIDS; IRON ALLOYS; IRON BASE ALLOYS; MATERIALS; NICKEL ALLOYS; STAINLESS STEELS; STEEL-CR18NI8; STEELS; 360105* - Metals & Alloys- Corrosion & Erosion; 360103 - Metals & Alloys- Mechanical Properties","The corrosive wear behavior of high-alloy stainless steels (SS) under sliding conditions was investigated in 20 wt% sulfuric acid (H[sub 2]SO[sub 4]) solution. Experiments showed a negative shift of the corrosion potential, positive shift of critical passivation potential, and steady passivation potential could be regarded as accelerative effects of wear on corrosion. For 18-8 austenitic SS (UNS S30302), it was concluded that the accelerative effect of wear on corrosion increased with increases of the corrosion rate.","","","","","","United States","1993-10-01T00:00:00Z","English","Journal Article","","Journal Name: Corrosion (Houston); (United States); Journal Volume: 49:10","","Medium: X; Size: Pages: 836-841","","","","Journal ID: ISSN 0010-9312; CODEN: CORRAK","10.5006/1.3316007","","2016-04-26T00:00:00Z","5842341","https://www.osti.gov/biblio/5842341","","Corrosion (Houston); (United States)","","49:10"
"Measurement of branching ratios of low energy deuteron-induced nuclear reactions on [sup 2]H, [sup 6]Li, and [sup 10]B","Cecil, F E; Liu, H; Yan, J S; Hale, G M","73 NUCLEAR PHYSICS AND RADIATION PHYSICS; BORON 10 TARGET; DEUTERON REACTIONS; DEUTERIUM TARGET; BRANCHING RATIO; LITHIUM 6 TARGET; ALPHA PARTICLES; BERYLLIUM 8; BORON 11; HELIUM 3; HELIUM 4; KEV RANGE 01-10; KEV RANGE 10-100; KEV RANGE 100-1000; LITHIUM 7; NEUTRONS; PROTONS; TRITIUM; ALKALI METAL ISOTOPES; ALKALINE EARTH ISOTOPES; ALPHA DECAY RADIOISOTOPES; BARYONS; BERYLLIUM ISOTOPES; BETA DECAY RADIOISOTOPES; BETA-MINUS DECAY RADIOISOTOPES; BORON ISOTOPES; CHARGED PARTICLES; CHARGED-PARTICLE REACTIONS; ELEMENTARY PARTICLES; ENERGY RANGE; EVEN-EVEN NUCLEI; EVEN-ODD NUCLEI; FERMIONS; HADRONS; HELIUM ISOTOPES; HYDROGEN ISOTOPES; ISOTOPES; KEV RANGE; LIGHT NUCLEI; LITHIUM ISOTOPES; NUCLEAR REACTIONS; NUCLEI; NUCLEONS; ODD-EVEN NUCLEI; RADIOISOTOPES; SECONDS LIVING RADIOISOTOPES; STABLE ISOTOPES; TARGETS; YEARS LIVING RADIOISOTOPES; 663440* - D-, T-, & He-induced Reactions & Scattering- (1992-); 663510 - Nuclear Mass Ranges- A=1-5- (1992-); 663520 - Nuclear Mass Ranges- A=6-19- (1992-)","We have measured the branching ratios [sup 2]H([ital d],[ital p])[sup 3]H/[sup 2]H([ital d],[ital n])[sup 3]He, [sup 6]Li([ital d],[ital p])[sup 7]Li/[sup 6]Li([ital d],[alpha])[sup 4]He, and [sup 10]B([ital d],[ital p])[sup 11]B/[sup 10]B([ital d],[alpha])[sup 8]Be between c.m. energies of 3 and 15 keV, 20 and 135 keV, and 58 and 142 keV, respectively. Our measurements of the [sup 2]H-[ital d] reaction are in good agreement with [ital R]-matrix calculations of the branching ratio. We find no enhancement of the ([ital d],[ital p]) branches of these reactions at the lowest observed energies. Implications of our findings to recent claims of anomalous production of heat from deuterium-metal systems are presented.","","","","","","United States","1993-03-01T00:00:00Z","English","Journal Article","","Journal Name: Physical Review, C (Nuclear Physics); (United States); Journal Volume: 47:3","","Medium: X; Size: Pages: 1178-1183","","","","Journal ID: ISSN 0556-2813; CODEN: PRVCAN; TRN: 93-005998","10.1103/PhysRevC.47.1178","","2009-12-17T00:00:00Z","6688939","https://www.osti.gov/biblio/6688939","","Physical Review, C (Nuclear Physics); (United States)","","47:3"
"Phenolic compounds containing/neutral fractions extract and products derived therefrom from fractionated fast-pyrolysis oils","Chum, Helena L; Black, Stuart K; Diebold, James P; Kreibich, Roland E","phenolic; compounds; containing; neutral; fractions; extract; products; derived; therefrom; fractionated; fast-pyrolysis; oils; process; preparing; phenol-formaldehyde; novolak; resins; molding; compositions; portions; phenol; normally; contained; replaced; obtained; fractionating; fractionation; consists; neutralization; stage; carried; aqueous; solutions; bases; appropriate; dry; followed; solvent; extraction; organic; moderate; solubility; parameter; hydrogen; bonding; capacity; compounds-containing; extracts; lignocellulosic; material; oil; initially; ph; range; 2-4; neutralized; bicarbonate; base; extracted; approximately; 4-9; 11; cal; cm; polar; components; 8-3; recovery; product; purification; adhesives; characterized; mixture; wide; variety; chemical; functionalities; including; carbonyl; aldehyde; methoxyl; vinyl; hydroxyl; thermosetting; shown; advantages; conventional; ph range; pyrolysis oils; neutral fractions; cellulosic material; products derived; fast-pyrolysis oils; solubility parameter; pyrolysis oil; thermosetting resin; solvent extraction; organic solvent; aqueous solution; aqueous solutions; wide variety; lignocellulosic material; compounds containing; derived therefrom; preparing phenol-formaldehyde; normally contained; phenol normally; fractions extract; fractionating fast-pyrolysis; phenolic compounds; molding compounds; molding compositions; molding composition; molding compound; extract obtained; thermosetting resins; fractionated fast-pyrolysis; compounds contain; phenol-formaldehyde resin; solvent extract; /528/428/999/585/","A process for preparing phenol-formaldehyde novolak resins and molding compositions in which portions of the phenol normally contained in said resins are replaced by a phenol/neutral fractions extract obtained from fractionating fast-pyrolysis oils. The fractionation consists of a neutralization stage which can be carried out with aqueous solutions of bases or appropriate bases in the dry state, followed by solvent extraction with an organic solvent having at least a moderate solubility parameter and good hydrogen bonding capacity. Phenolic compounds-containing/neutral fractions extracts obtained by fractionating fast-pyrolysis oils from a lignocellulosic material, is such that the oil is initially in the pH range of 2-4, being neutralized with an aqueous bicarbonate base, and extracted into a solvent having a solubility parameter of approximately 8.4-9.11 [cal/cm.sup.3 ].sup.1/2 with polar components in the 1.8-3.0 range and hydrogen bonding components in the 2-4.8 range and the recovery of the product extract from the solvent with no further purification being needed for use in adhesives and molding compounds. The product extract is characterized as being a mixture of very different compounds having a wide variety of chemical functionalities, including phenolic, carbonyl, aldehyde, methoxyl, vinyl and hydroxyl. The use of the product extract on phenol-formaldehyde thermosetting resins is shown to have advantages over the conventional phenol-formaldehyde resins.","","","Midwest Research Institute, Kansas City, MO (United States)","","","United States","1993-01-01T00:00:00Z","English","Patent","","","","Medium: ED","","","AC02-83CH10093","","","Patent Assignee: Midwest Research Institute Ventures, Inc. (Kansas City, MO)","2023-01-23T00:00:00Z","868832","https://www.osti.gov/biblio/868832","https://www.osti.gov/servlets/purl/868832","","",""
"Solar-neutrino experiments","Bethe, H A","72 PHYSICS OF ELEMENTARY PARTICLES AND FIELDS; SOLAR NEUTRINOS; MASS; BORON 8; CABIBBO ANGLE; CHLORINE 37; CONVECTION; GALLIUM 71; HEAVY WATER; LIQUID SCINTILLATION DETECTORS; MAGNETIC FIELDS; MAGNETIC MOMENTS; NEUTRINO DETECTION; NEUTRINO OSCILLATION; SEMICONDUCTOR DETECTORS; SOLAR ACTIVITY; SUPERNOVAE; BETA DECAY RADIOISOTOPES; BETA-PLUS DECAY RADIOISOTOPES; BORON ISOTOPES; CHLORINE ISOTOPES; DETECTION; ELEMENTARY PARTICLES; ENERGY TRANSFER; ERUPTIVE VARIABLE STARS; FERMIONS; GALLIUM ISOTOPES; HEAT TRANSFER; HYDROGEN COMPOUNDS; INTERMEDIATE MASS NUCLEI; ISOTOPES; LEPTONS; LIGHT NUCLEI; MASS TRANSFER; MASSLESS PARTICLES; MEASURING INSTRUMENTS; NEUTRINOS; NUCLEI; ODD-EVEN NUCLEI; ODD-ODD NUCLEI; OXYGEN COMPOUNDS; RADIATION DETECTION; RADIATION DETECTORS; RADIATIONS; RADIOISOTOPES; SCINTILLATION COUNTERS; SECONDS LIVING RADIOISOTOPES; SOLAR PARTICLES; SOLAR RADIATION; STABLE ISOTOPES; STARS; STELLAR RADIATION; VARIABLE STARS; WATER; 645203* - High Energy Physics- Particle Interactions & Properties-Theoretical- Weak Interactions & Properties","The observation of solar neutrinos at Kamiokande rules out the Mikheyev-Smirnov-Wolfenstein (MSW) theory with a large'' mass difference between the neutrinos, {Delta}{ital m}{sup 2}{congruent}10{sup {minus}4} eV{sup 2}. There remain the MSW theory with a small {Delta}{ital m}{sup 2}{congruent}10{sup {minus}7} eV{sup 2} or the assumption of unexpectedly low central temperature in the Sun. A decision between these two alternatives will be possible on the basis of the future gallium experiment, and the Sudbury experiment with heavy water.","","","","","","United States","1989-08-21T00:00:00Z","English","Journal Article","","Journal Name: Physical Review Letters; (USA); Journal Volume: 63:8","","Medium: X; Size: Pages: 837-839","","","","Journal ID: ISSN 0031-9007; CODEN: PRLTA; TRN: 89-026422","10.1103/PhysRevLett.63.837","","2009-12-16T00:00:00Z","5540374","https://www.osti.gov/biblio/5540374","","Physical Review Letters; (USA)","","63:8"
"Direct approach to resolve the solar-neutrino problem","Chen, H H","71 CLASSICAL AND QUANTUM MECHANICS, GENERAL PHYSICS; 46 INSTRUMENTATION RELATED TO NUCLEAR SCIENCE AND TECHNOLOGY; NEUTRINO DETECTION; CHERENKOV COUNTERS; NEUTRINO-DEUTERON INTERACTIONS; CHARGED-CURRENT INTERACTIONS; NEUTRAL-CURRENT INTERACTIONS; SOLAR NEUTRINOS; BETA-PLUS DECAY; BORON 8; HEAVY WATER; NEUTRINO OSCILLATION; BETA DECAY; BETA DECAY RADIOISOTOPES; BETA-PLUS DECAY RADIOISOTOPES; BORON ISOTOPES; DECAY; DETECTION; ELEMENTARY PARTICLES; FERMIONS; HYDROGEN COMPOUNDS; INTERACTIONS; ISOTOPES; LEPTON-BARYON INTERACTIONS; LEPTON-HADRON INTERACTIONS; LEPTONS; LIGHT NUCLEI; MASSLESS PARTICLES; MEASURING INSTRUMENTS; NEUTRINOS; NUCLEI; ODD-ODD NUCLEI; OXYGEN COMPOUNDS; PARTICLE INTERACTIONS; RADIATION DETECTION; RADIATION DETECTORS; RADIATIONS; RADIOISOTOPES; SECONDS LIVING RADIOISOTOPES; SOLAR PARTICLES; SOLAR RADIATION; STELLAR RADIATION; WATER; 640104* - Astrophysics & Cosmology- Solar Phenomena; 440104 - Radiation Instrumentation- High Energy Physics Instrumentation","A direct approach to resolve the solar-neutrino problem would be to observe neutrinos by use of both neutral-current and charged-current reactions. Then, the total neutrino flux and the electron neutrino flux would be separately determined to provide independent tests of the neutrino-oscillation hypothesis and the standard solar model. A large heavy-water Cherenkov detector, sensitive to neutrinos from /sup 8/B decay via the neutral-current reaction ..nu..+d..--> nu..+p+n and the charged-current reaction ..nu../sub e/+d..-->..e/sup -/+p+p is suggested for this purpose.","","","Department of Physics, University of California, Irvine, California 92717","","","United States","1985-09-30T00:00:00Z","English","Journal Article","","Journal Name: Phys. Rev. Lett.; (United States); Journal Volume: 55:14","","Medium: X; Size: Pages: 1534-1536","","","","Journal ID: CODEN: PRLTA; TRN: 85-022604","10.1103/PhysRevLett.55.1534","","2009-12-16T00:00:00Z","5315576","https://www.osti.gov/biblio/5315576","","Phys. Rev. Lett.; (United States)","","55:14"
"Spin dependence of the. lambda. N effective interaction","Millener, D J; Gal, A; Dover, C B; Dalitz, R H","72 PHYSICS OF ELEMENTARY PARTICLES AND FIELDS; BERYLLIUM 9; HYPERNUCLEI; BORON 11; BORON 12; HELIUM 4; HYDROGEN 4; NUCLEAR POTENTIAL; LITHIUM 8; EFFECTIVE RANGE THEORY; ENERGY-LEVEL TRANSITIONS; GAMMA RADIATION; J-J COUPLING; L-S COUPLING; LAMBDA PARTICLES; MATRIX ELEMENTS; NUCLEON-HYPERON INTERACTIONS; SHELL MODELS; SPIN; TENSOR FORCES; TWO-BODY PROBLEM; WAVE FUNCTIONS; ALKALI METAL ISOTOPES; ALKALINE EARTH ISOTOPES; ANGULAR MOMENTUM; BARYON-BARYON INTERACTIONS; BARYONS; BERYLLIUM ISOTOPES; BETA DECAY RADIOISOTOPES; BETA-MINUS DECAY RADIOISOTOPES; BORON ISOTOPES; COUPLING; ELECTROMAGNETIC RADIATION; ELEMENTARY PARTICLES; EVEN-EVEN NUCLEI; EVEN-ODD NUCLEI; FERMIONS; FUNCTIONS; HADRON-HADRON INTERACTIONS; HADRONS; HELIUM ISOTOPES; HYDROGEN ISOTOPES; HYPERONS; INTERACTIONS; INTERMEDIATE COUPLING; IONIZING RADIATIONS; ISOTOPES; LIGHT NUCLEI; LITHIUM ISOTOPES; MANY-BODY PROBLEM; MATHEMATICAL MODELS; NUCLEAR FRAGMENTS; NUCLEAR MODELS; NUCLEI; ODD-EVEN NUCLEI; ODD-ODD NUCLEI; PARTICLE INTERACTIONS; PARTICLE PROPERTIES; POTENTIALS; RADIATIONS; RADIOISOTOPES; SECONDS LIVING RADIOISOTOPES; STABLE ISOTOPES; STRANGE PARTICLES; 645207* - High Energy Physics- Particle Interactions & Properties-Theoretical- Strong Interactions, Baryon No. Greater than 1- (-1987)","A combination of theoretical estimates, based on a ..lambda..N potential model and phenomenological analysis of hypernuclear data, is used to determine a set of four p/sub N/s/sub ..lambda../ two-body matrix elements which characterize the spin dependence of the ..lambda..N interaction in the p shell. The central spin-spin and the ..lambda.. spin-orbit matrix elements are most strongly constrained by existing data. The spin dependence is weak in the sense that (core) x s/sub ..lambda../ doublet splittings are predicted to be of order 100 keV, except for the special case of /sub ..lambda..//sup 7/Li where the central spin-spin interaction dominates and the ground state doublet splitting is likely to be of order 600 keV. Detailed consideration is given to those ..gamma.. ray transitions the observation of which would best serve to further constrain the spin dependence of the ..lambda..N interaction, particularly the tensor interaction.","","","Brookhaven National Laboratory, Upton, New York 11973","","","United States","1985-02-01T00:00:00Z","English","Journal Article","","Journal Name: Phys. Rev. C; (United States); Journal Volume: 31:2","","Medium: X; Size: Pages: 499-509","","","AC02-76CH00016","Journal ID: CODEN: PRVCA; TRN: 85-004109","10.1103/PhysRevC.31.499","","2016-05-26T00:00:00Z","5996501","https://www.osti.gov/biblio/5996501","","Phys. Rev. C; (United States)","","31:2"
"Gamma-ray spectroscopy of hypernuclei","Chrien, R E","73 NUCLEAR PHYSICS AND RADIATION PHYSICS; 72 PHYSICS OF ELEMENTARY PARTICLES AND FIELDS; BERYLLIUM 9; HYPERNUCLEI; BORON 10; ENERGY-LEVEL TRANSITIONS; LITHIUM 7; BERYLLIUM 8; CARBON 12; EXPERIMENTAL DATA; GAMMA SPECTRA; GAMMA SPECTROSCOPY; HELIUM 4; HYDROGEN 4; IN-BEAM SPECTROSCOPY; LAMBDA PARTICLES; SHELL MODELS; ALKALI METAL ISOTOPES; ALKALINE EARTH ISOTOPES; ALPHA DECAY RADIOISOTOPES; BARYONS; BERYLLIUM ISOTOPES; BORON ISOTOPES; CARBON ISOTOPES; DATA; ELEMENTARY PARTICLES; EVEN-EVEN NUCLEI; EVEN-ODD NUCLEI; FERMIONS; HADRONS; HELIUM ISOTOPES; HYDROGEN ISOTOPES; HYPERONS; INFORMATION; ISOTOPES; LIGHT NUCLEI; LITHIUM ISOTOPES; MATHEMATICAL MODELS; NUCLEAR FRAGMENTS; NUCLEAR MODELS; NUCLEI; NUMERICAL DATA; ODD-EVEN NUCLEI; ODD-ODD NUCLEI; RADIOISOTOPES; SECONDS LIVING RADIOISOTOPES; SPECTRA; SPECTROSCOPY; STABLE ISOTOPES; STRANGE PARTICLES; 651323* - Nuclear Properties & Reactions, A=6-19, Experimental- Energy Levels & Transitions- (-1987); 645100 - High Energy Physics- Particle Interactions & Properties-Experimental","The study of hypernuclei is a frontier area of nuclear physics. As more intense beams of strange mesons have become available, methods of in-beam spectroscopy have been applied to the study of hypernuclei. The feasibility of detecting hypernuclear electromagnetic radiation has been demonstrated at the Brookhaven Alternating Gradient Synchrotron. Studies have been made of the effective LAMBDA hyperon-nucleon interaction in p-shell hypernuclei. The first results are described and they place useful constraints on the effective interaction and the shell model description of hypernuclear states.","","NTIS, PC A03/MF A01; 1.","Brookhaven National Lab., Upton, NY (USA)","","","United States","1984-01-01T00:00:00Z","English","Conference","Technical Report","Conference: International symposium on in-beam nuclear spectroscopy, Debrecen, Hungary, 14 May 1984; Other Information: Portions are illegible in microfiche products","","Medium: ED; Size: Pages: 28","","BNL-34846; CONF-840530-4","AC02-76CH00016","ON: DE84013142","","","2008-08-25T00:00:00Z","6812386","https://www.osti.gov/biblio/6812386","https://www.osti.gov/servlets/purl/6812386","","",""
"Mechanisms of the oxidation of metals and alloys. Annual progress report, 1 July 1982-30 June 1983","Yurek, G J; LaBranche, M; Martin, K; Garratt-Reed, A","36 MATERIALS SCIENCE; ALUMINIUM ALLOYS; OXIDATION; CHROMIUM; SULFIDATION; CHROMIUM ALLOYS; IRON BASE ALLOYS; STAINLESS STEEL-18-8; CHEMICAL REACTION KINETICS; CHROMIUM OXIDES; EXPERIMENTAL DATA; GRAIN SIZE; HYDROGEN; HYDROGEN SULFIDES; PHASE STUDIES; RESEARCH PROGRAMS; SCALING; TEMPERATURE DEPENDENCE; THERMODYNAMICS; VERY HIGH TEMPERATURE; WATER VAPOR; ALLOYS; CHALCOGENIDES; CHEMICAL REACTIONS; CHROMIUM COMPOUNDS; CHROMIUM STEELS; CHROMIUM-NICKEL STEELS; CORROSION RESISTANT ALLOYS; CRYSTAL STRUCTURE; DATA; ELEMENTS; FLUIDS; GASES; HYDROGEN COMPOUNDS; INFORMATION; IRON ALLOYS; KINETICS; METALS; MICROSTRUCTURE; NICKEL ALLOYS; NONMETALS; NUMERICAL DATA; OXIDES; OXYGEN COMPOUNDS; REACTION KINETICS; SIZE; STAINLESS STEELS; STEELS; SULFIDES; SULFUR COMPOUNDS; TRANSITION ELEMENT COMPOUNDS; TRANSITION ELEMENTS; VAPORS; 360105* - Metals & Alloys- Corrosion & Erosion","Progress is reported on: oxidation of Cr, phase equilibria and thermodynamics in the Cr-S and Cr-S-O systems, oxidation/sulfidation of Cr in H/sub 2/-H/sub 2/O-H/sub 2/S gas mixtures, oxidation/sulfidation of Fe-25 wt % Cr at 900/sup 0/C, oxidation of binary Fe-8 wt % Al alloys in H/sub 2/-H/sub 2/O and H/sub 2/H/sub 2/O-H/sub 2/S gas mixtures, and mechanisms of the oxidation of rapidly solidified alloys (18Cr-8Ni stainless steel). 10 figures.","","NTIS, PC A03/MF A01; 1.","Massachusetts Inst. of Tech., Cambridge (USA). Dept. of Materials Science and Engineering","","","United States","1983-07-27T00:00:00Z","English","Technical Report","","Other Information: Portions are illegible in microfiche products","","Medium: X; Size: Pages: 36","","DOE/ER/10507-4","AC02-79ER10507","ON: DE83017100","","","2008-02-07T00:00:00Z","5696468","https://www.osti.gov/biblio/5696468","","","",""
"Measurement of the spectra of light nuclei in ternary fission of /sup 252/Cf and search for the isotopes /sup 10/He and /sup 7/H","Aleksandrov, D V; Glukhov, Y A; Dem'yanova, A S; Dukhanov, V I; Mazurov, I B; Novatskii, B G; Ogloblin, A A; Sakuta, S B; Stepanov, D N","73 NUCLEAR PHYSICS AND RADIATION PHYSICS; CALIFORNIUM 252; SPONTANEOUS FISSION; HELIUM 10; FISSION YIELD; HYDROGEN 7; HELIUM 4; HELIUM 6; HELIUM 8; ISOTOPE PRODUCTION; NEUTRON-RICH ISOTOPES; STABILITY; TRITIUM; ACTINIDE ISOTOPES; ACTINIDE NUCLEI; ALPHA DECAY RADIOISOTOPES; BETA DECAY RADIOISOTOPES; BETA-MINUS DECAY RADIOISOTOPES; CALIFORNIUM ISOTOPES; DECAY; EVEN-EVEN NUCLEI; FISSION; HEAVY NUCLEI; HELIUM ISOTOPES; HYDROGEN ISOTOPES; ISOTOPES; LIGHT NUCLEI; NUCLEAR REACTION YIELD; NUCLEAR REACTIONS; NUCLEI; ODD-EVEN NUCLEI; RADIOISOTOPES; SECONDS LIVING RADIOISOTOPES; STABLE ISOTOPES; YEARS LIVING RADIOISOTOPES; YIELDS; 652026* - Nuclear Properties & Reactions, A=220 & above, Experimental- Spontaneous & Induced Fission- (-1987)","The energy spectra of the isotopes /sup 4/He, /sup 6/He, /sup 8/He, and /sup 3/H in spontaneous fission of /sup 252/Cf have been measured by the ..delta..E--E technique. A search was made and upper limits of yields determined for the nuclides /sup 10/He and /sup 7/H. On the basis of the results of the experiment it is concluded that the nuclei /sup 10/He and /sup 7/H are unstable against decay into nucleons.","","","I. V. Kurchatov Institute of Atomic Energy","","","United States","1982-12-01T00:00:00Z","English","Journal Article","","Journal Name: Sov. J. Nucl. Phys. (Engl. Transl.); (United States); Journal Volume: 36:6","","Medium: X; Size: Pages: 783-785","","","","Journal ID: CODEN: SJNCA","","","2009-12-17T00:00:00Z","6042414","https://www.osti.gov/biblio/6042414","","Sov. J. Nucl. Phys. (Engl. Transl.); (United States)","","36:6"
"Study of the reactions (/sup 6/Li,/sup 8/B) and (/sup 7/Li,/sup 8/B) in light nuclei","Aleksandrov, D; Glukhov, Y; Dem'yanova, A; Dukhanov, V; Mazurov, I; Novatskii, B; Ogloblin, A; Sakuta, S; Stepanov, D","73 NUCLEAR PHYSICS AND RADIATION PHYSICS; BERYLLIUM 9 TARGET; LITHIUM 7 REACTIONS; CARBON 12 TARGET; LITHIUM 6 REACTIONS; HELIUM 8; ENERGY LEVELS; TWO-NUCLEON TRANSFER REACTIONS; LITHIUM 6 TARGET; ONE-NUCLEON TRANSFER REACTIONS; BERYLLIUM 10; BERYLLIUM 11; BORON 8; DIFFERENTIAL CROSS SECTIONS; EXPERIMENTAL DATA; HYDROGEN 4; MEV RANGE 10-100; PARITY; SPIN; ALKALINE EARTH ISOTOPES; ANGULAR MOMENTUM; BERYLLIUM ISOTOPES; BETA DECAY RADIOISOTOPES; BETA-MINUS DECAY RADIOISOTOPES; BETA-PLUS DECAY RADIOISOTOPES; BORON ISOTOPES; CHARGED-PARTICLE REACTIONS; CROSS SECTIONS; DATA; DIRECT REACTIONS; ENERGY RANGE; EVEN-EVEN NUCLEI; EVEN-ODD NUCLEI; HEAVY ION REACTIONS; HELIUM ISOTOPES; HYDROGEN ISOTOPES; INFORMATION; ISOTOPES; LIGHT NUCLEI; MEV RANGE; MULTI-NUCLEON TRANSFER REACTIONS; NUCLEAR REACTIONS; NUCLEI; NUMERICAL DATA; ODD-ODD NUCLEI; PARTICLE PROPERTIES; RADIOISOTOPES; SECONDS LIVING RADIOISOTOPES; TARGETS; TRANSFER REACTIONS; YEARS LIVING RADIOISOTOPES; 651325* - Nuclear Properties & Reactions, A=6-19, Experimental- Nuclear Reactions & Scattering- (-1987)","The reactions /sup 12/C(/sup 6/Li,/sup 8/B)/sup 10/Be ,/sup 6/Li(/sup 6/Li,/sup 8/B)/sup 4/H, /sup 12/C(/sup 7/Li,/sup 8/B)/sup 11/Be, and /sup 9/Be(/sup 7/Li,/sup 8/B)/sup 8/He have been studied at energies E/sub 6Li/ = 72 MeV and E/sub 7Li/ = 83 MeV at angles theta/sub lab/ = 10 and 12/sup 0/. The differential cross sections for the first two reactions are approx.10 ..mu..b/sr, and for /sup 9/Be(/sup 7/Li,/sup 8/B)/sup 8/He they do not exceed 0.1 ..mu..b/sr. An excited state of /sup 8/He with E* = 2.6 +- 0.2 MeV is observed. It is suggested that the spin and parity of this level are 2/sup +/.","","","I. V. Kurchatov Institute of Atomic Energy","","","United States","1982-02-01T00:00:00Z","English","Journal Article","","Journal Name: Sov. J. Nucl. Phys. (Engl. Transl.); (United States); Journal Volume: 35:2","","Medium: X; Size: Pages: 158-160","","","","Journal ID: CODEN: SJNCA","","","2009-12-16T00:00:00Z","5019974","https://www.osti.gov/biblio/5019974","","Sov. J. Nucl. Phys. (Engl. Transl.); (United States)","","35:2"
