"TITLE","AUTHORS","SUBJECT","DESCRIPTION","PUBLISHER","AVAILABILITY","RESEARCH_ORG","SPONSORING_ORG","CONTRIBUTING_ORG","PUBLICATION_COUNTRY","PUBLICATION_DATE","LANGUAGE","RESOURCE_TYPE","TYPE_QUALIFIER","RELATION","COVERAGE","FORMAT","IDENTIFIER","REPORT_NUMBER","DOE_CONTRACT_NUMBER","OTHER_IDENTIFIER","DOI","RIGHTS","ENTRY_DATE","OSTI_IDENTIFIER","CITATION_URL","PURL_URL","JOURNAL_NAME","JOURNAL_ISSUE","JOURNAL_VOLUME"
"PROGRESS RELATING TO CIVILIAN APPLICATIONS DURING JANUARY, 1959","Dayton, R W; Tipton, Jr, C R","METALLURGY AND CERAMICS; ADSORPTION; ALKANES; ALLOTROPY; ALUMINUM ALLOYS; ANNEALING; BONDING; BUILDING MATERIALS; CASTING; CEMENTS; CERMETS; CETANE; CHROMATOGRAPHY; CHROMIUM ALLOYS; COLD WORKING; COMPUTERS; CONTROL; COOLANTS; CORROSION; CREEP; CYLINDERS; DAREX PROCESS; DODECANE; EXTRUSION; FABRICATION; FAST NEUTRONS; FATIGUE; FISSION PRODUCTS; FLUORIDES; FORGING; FREQUENCY; FUEL ELEMENTS; FUELS; GASES; GRAPHITE; HIGH TEMPERATURE; HYDROGEN; INCONEL ALLOYS; INFRARED RADIATION; INOR-8; IRRADIATION; LEAKS; MAGNESIUM; MATERIALS TESTING; MEASURED VALUES; MECHANICAL PROPERTIES; MODERATORS; MOLYBDENUM ALLOYS; NEUTRON FLUX; NICKEL ALLOYS; NIOBIUM; NIOBIUM ALLOYS; OCTANE; OXID","Thermal-conductivity measurements are in progress on an unirradiated, unclad, natural U specimen. Data are presented on thermal conductivity measurements performed on UO/sub 2/. The creep properties of annealed and of 15% cold-worked Zircaloy-2 are being studied. A program was initiated to evaluate loss-of-coolant incidents in the PRTR by means of simulation on a digital computer. Research on the casting of hollow Al-35 wt. extrusion billets is reported. Further refinement of the method developed for the analysis of Mg in cement is in progress. The infrared and gaschromatography analysis of irradiated dodecane, decane, cetane. and octane, and their urea complexes, were continued. The manner in which U metal solidifies in cylindrical graphite molds is under study. Work has continued on development of a stabilized hightemperature nuclear fuel capable of operation in either oxidizing or reducing atmospheres. Progress in the stud of potential fueled moderators has continued with the determination of hydrogen-absorption isotherms for the Zr-25 wt. alloy. The effect of fast-neutron flux on the mechanical properties of AISI Tvpe 347 stainless steel are being determined and evaluated. The forging of Nb-U alloys is reported. Thorium-uranium alloys are being studied for the purpose of developing improved corrosion resistance and irradiation stability of the alloy by means of alloying and control of processing variables. The causes of fission-gas loss from refractory fuel materials is being investigated. Cermet fuel materials consisting of from 60 to 90 vol. % U0/sub 2/, UN, or UC dispersed in a stainless steel or Nb matrix are being investigated. The gas-pressure bonding technique is being investigated for cladding and bonding Nband Mo-base fuel elements and assemblies. Dispersion fuels consisting of UC and UN dispersed in stainless steel were irradiated in the WTR. Stress-cycling tests were continued on Inconel specimens at 1300 and 1500 F, cycled at 1 cps. The investigation of temperature and frequency dependence of fatigue properties of INOR-8 alloy is being investigated, Studies of U compounds and the mechanism of thermal migration of hydrogen in zirconium are in progress. In the research on thermal migration of H/sub 2/ in Zr, new data on the diffusion coefficients of H/sub 2/ in beta Zr were obtained. Data are presented on postirradiation examination of three pairs of fueled-graphite spheres. The evaluation of materials of construction for use in the Darex, SulfexThorex, Zirflex. and Fluoride-Volatility processes of nuclear fuel recovery was continued. Uranium carbide containing 5 wt. % carbon is being studied as a fuel for the SRE. A study of the properties of Ta-W alloys is continuing. A compartmentalized flat-plate Zircaloy2-clad fuel element containing UO/sub 2/ cores is being considered for PWR Core-2. Techniques for the fabrication of graphite-matrix fuel cores containing 20 vol. % UC in form of UC and UC/sub 2/ are reported. (For preceding period see BMI-1307.) (W.L.H.)","","NTIS","Battelle Memorial Inst., Columbus, OH (United States)","","","United States","1959-02-01T00:00:00Z","English","Technical Report","","Other Information: Decl. June 12, 1959. Orig. Receipt Date: 31-DEC-59","","Medium: P; Size: Pages: 86","","BMI-1315","W-7405-ENG-92","","10.2172/4245308","","2016-06-27T00:00:00Z","4245308","https://www.osti.gov/biblio/4245308","https://www.osti.gov/servlets/purl/4245308","","",""
"PROGRESS RELATING TO CIVILIAN APPLICATIONS DURING DECEMBER, 1958","Dayton, R W; Tipton, Jr, C R","METALLURGY AND CERAMICS; ADSORPTION; AIR; ALUMINUM ALLOYS; ANNEALING; BERYLLIUM OXIDES; BOILING; BONDING; BUILDING MATERIALS; CANNING; CASTING; CEMENTS; CERMETS; CHEMICAL REACTIONS; CHROMIUM ALLOYS; COLD WORKING; COPPER ALLOYS; CORROSION; CREEP; CYLINDERS; DAREX PROCESS; DENSITY; DOSEMETERS; ELECTRIC ARCS; FAST NEUTRONS; FATIGUE; FISSION PRODUCTS; FUEL ELEMENTS; FUELS; GAS COOLANT; GASES; GRAPHITE; HEAT TREATMENTS; HEATING; HIGH TEMPERATURE; HYDROGEN; INCONEL ALLOYS; INOR-8; IRON ALLOYS; IRRADIATION; MAGNESIUM; MEASURED VALUES; MECHANICAL PROPERTIES; MELTING; MIXING; MOLYBDENUM; MOLYBDENUM ALLOYS; NI-O-NEL; NICKEL ALLOYS; NIOBIUM; NIOBIUM ALLOYS; NITROGEN; ORGANIC MO","Thermal-conductivity measurements were completed from 100 to 600 deg C on UO/sub 2/ specimens. An investigation of the creep properties of annealed and of 15% coldworked Zircaloy-2 in the 290 to 400 deg C temperature range is being conducted. Research to develop a method of sink-float density measurements to identify factors affecting irradiation-induced volume changes in graphite was continued. An increase in the U content of Al-U alloys is desirable as a means of increasing the fuel loading of reactors utilizing these fuels. The development of the radiometric method for the analysis of Mg in cement was completed. A study of the solidification of U castings in cylindrical graphite molds is being conducted. Experimental work was continued to reduce the amount of additive oxide (La/sub 2/O/sub 3/, CaO, and Y/sub 2/O/sub 3/) required to achieve stabilization of uranium oxides. Additional H/sub 2/-adsorption isotherms were obtained for the Zr-25 wt.% U alloy. An irradiation surveillance program is being conducted to determine the effect of fast neutrons on the mechanical properties of type 347 stainless steel. The study concerned with the properties of Nb-U alloys was continued. A program is being conducted to investigate methods for improving the irradiation behavior and corrosion properties of Th -U alloys. An investigation is being made of cermet fuel materials consisting of from 60 to 90 vol. % of U0/sub 2/, UN, or UC dispersed in stainless steel. Gas-pressure bonding of Mo- and Nb-clad fuel elements is reported. A study to evaluate the irradiation resistance of dispersion fuel elements consisting of UC or UN fuel dispersed in a stainless steel matrix clad with stainless steel is reported. Fatigue studies of Inconel and INOR-8 are reported. A study of the constitution of U-Nb alloys is being conducted. Fundamental studies are being made of the kinetics and mechanism of the reaction of N/sub 2/ with Nb. The examination and evaluation of six 1.5-inch-diameter fueled (U0/sub 2/) graphite spheres after irradiation is reported. Localized attack on Ti steam tubes exposed to Darex dissolver solutions appears to be connected with defective areas in the tubes. Heat treatment of Ni-o-nel for 0.5 hr at 1850 deg F with an air quench following welding has produced the most resistance to Thorex solutions of any treatmert studied. The conditions prevailing during dissolution of Type 304 stainless steel in boiling 6 M H/sub 2/ SO/sub 4/ give corrosion rates in the range of 2 to 3 mils per month for Ni-o-nel specimens exposed to the vapor. Scouting experiments have shown the Zirflex decladding solution to be excessively corrosive to Type 347 and Carpenter 20 Cb stainless steels and Ni-o-nel. Raising the temperature from 650 to 700 deg C practically doubles the corrosiveness of the equimolar NaF-ZrF/sub 4/ salt. The evaluation of UC as a fuel for the SRE is proceeding. The amount of fission product Xe/sup 133/ released from UC as a function of time and temperature of post-irradiation heating was determined. The results of measurements of fission- gas release from Th-11 wt. % U specimers are reported. The effects of radiation and corrosion by the organic moderator on certain structural materials planned for use in the Organic Moderated Reactor are being studied. Properties of arc- melted Ta and Ta-W alloys are presented. A flat-plate Zircaloy-2-clad fuel element containing compartmented U0/sub 2 fuel is being considered for Core 2 of the PWR. The postirradiation examination of two stainless steel-clad U0/sub 2/ specimens for the Maritime Gas-Cooled Reactor program is continuing. Experiments leading to the development of a BeO--U0/sub 2/ fuel element were begun. (For preceding period see BMI-1304.) (W.L.H.)","","NTIS","Battelle Memorial Inst., Columbus, OH (United States)","","","United States","1959-01-01T00:00:00Z","English","Technical Report","","Other Information: Decl. June 12, 1959. Orig. Receipt Date: 31-DEC-59","","Medium: P; Size: Pages: 82","","BMI-1307","W-7405-ENG-92","","10.2172/4234391","","2016-06-27T00:00:00Z","4234391","https://www.osti.gov/biblio/4234391","https://www.osti.gov/servlets/purl/4234391","","",""
"Electrophilic Hydrogen Isotope Substitutions. III. The Polyalkylbenzenes","Lauer, Walter M.; Stedman, Geoffrey","CHEMISTRY; ACETIC ACID; ACIDITY; ALKYL RADICALS; ALPHA PARTICLES; ANGULAR DISTRIBUTION; BENZENE; BERYLLIUM 8; BETA DECAY; BETA PARTICLES; CONFIGURATION; DECAY; DEUTERIUM COMPOUNDS; ENERGY LEVELS; EXCITATION; HEAVY WATER; HELIUM 4; HYDROGEN COMPOUNDS; INTERACTIONS; ISOMERS; ISOTOPIC EXCHANGE; LITHIUM 8; MEASURED VALUES; MIXING; NEUTRINOS; NUCLEAR MODELS; NUCLEAR THEORY; ORGANIC FLUORINE COMPOUNDS; PARITY; REACTION KINETICS; SPIN; STEREOCHEMISTRY; TENSORS; VECTORS","The rates of deuteration of a number of polyalkylbenzenes in mixtures of deuterium oxide and trifluoroacetic acid have been measured. The rate of exchange closely parallels the basicity of the hydrocarbon and can be predicted from the partial rate factors for the deuteration of the monoalkylbenzenes. The results provide further evidence that steric effects arc small for deuteration in trifluoroacetic acid and give approximate values for the meta partial rate factor for several alkyl groups.","American Chemical Society (ACS)","","Univ. of Minnesota, Minneapolis","USDOE","","Country unknown/Code not available","1958-12-01T00:00:00Z","English","Journal Article","","Journal Name: Journal of the American Chemical Society; Journal Volume: 80; Journal Issue: 23; Other Information: Orig. Receipt Date: 31-DEC-59","","Medium: X; Size: p. 6439-6441","","","","Journal ID: ISSN 0002-7863; 0002-7863","10.1021/ja01556a066","","2016-05-12T00:00:00Z","4260661","https://www.osti.gov/biblio/4260661","","Journal of the American Chemical Society","23","80"
"PROGRESS RELATING TO CIVILIAN APPLICATIONS DURING OCTOBER 1958","Dayton, R. W.; Tipton, Jr., C. R.","METALLURGY AND CERAMICS; BONDING; CAPSULES; ELECTRIC CONDUCTIVITY; FUEL CANS- - INTERMETALLIC COMPOUNDS; MEASURED VALUES; POTASSIUM ALLOYS; SODIUM ALLOYS; THERMAL CONDUCTIVITY; URANIUM ALLOYS; URANIUM DIOXIDE; ZIRCALOY; ZIRCONIUM ALLOYS; COLD WORKING; CREEP; FAILURES; FUEL CANS; INTERMETALLIC COMPOUNDS; STRESSES; TEMPERATURE; VACUUM; IMPURITIES; MEASURED VALUES- - MOLYBDENUM; MONOCRYSTALS; PREPARATION; RADIATION EFFECTS; ACTIVATION ANALYSIS; CEMENTS; NEUTRON BEAMS; ALKANES; IRRADIATION; ORGANIC ACIDS; QUALITATIVE ANALYSIS; UREA; CYLINDERS; SOLIDIFICATION; URANIUM; BISMUTH; COATING; CORROSION PROTECTION; CROLOY; LIQUID METALS; MOLYBDENUM COMPOUNDS; STAINLESS STEELS; AIR; HIGH TEMPERATURE; LANTHANUM OXIDES; STABILITY; YTTRIUM OXIDES; ADSORPTION; HYDROGEN; MECHANICAL PROPERTIES; NIOBIUM ALLOYS; CORROSION; THORIUM ALLOYS; ALUMINUM ALLOYS; CHROMIUM ALLOYS; FATIGUE; INCONEL ALLOYS; INOR-8; MOLYBDENUM ALLOYS; NICKEL ALLOYS; TITANIUM ALLOYS; CHEMICAL REACTIONS; NIOBIUM; NITROGEN; REACTION KINETICS; PHASE DIAGRAMS; FABRICATION; FUELS; GRAPHITE; SPHERES; QUANTITATIVE ANALYSIS; TENSILE PROPERTIES; URANIUM CARBIDES; PLUTONIUM ALLOYS; TANTALUM; TANTALUM ALLOYS; TUNGSTEN ALLOYS","Thermal-conductivity and electrical-resistivity measurements were made on U-1.5 wt,% Zr, encapsulated in Zircaloy-2 with a NaK thermal bond. Data are presented on thermal conductivity measurements made on UO/sub2/ specimens. A method of sink-float measurement to identify factors affecting irradiation- induced volume changes in graphite was continued. The stress-rupture and creep properties of 15% cold-worked Zircaloy-2 are being investigated in the 290 to 400 deg C temperature range in vacuum. High-purity single crystals of Mo are being prepared for irradiation-damage studies. A feasibility study of the neutron- activation method for the elemental analysis of portland cement was completed and preliminary experiments were initiated. The chemical analyses of irradiated and nonirradiated cetane, stearic acid, and the corresponding urea complexes were continued. A study of the mechanisms by which U solidifies in a cylindrical mold is being made. Coatings of Mo compounds on Croloy 2 1/4 were studied as potential protective coatings against liquid Bi. Work on the study of valence effects of oxide additions to UO/sub 2/ indicates that additions of Y/sub 6/O/sub 3/ are better stabilizers than La/sub 2/O/sub 3/ in 3000 deg F air. Measurements of hydrogen-absorption isotherms for the Zr-25 wt.% U alloy were made. An investigation was made of the effect of irradiation damage on the mechanical properties of type 347 stainless steel. Niobium uranium alloys containing 20 to 70 wt.% U were prepared in small heats. A program aimed at improving the irradiation stability and corrosion resistance of Th-U alloys is being conducted. Fatigue studies of Inconel and INOR-8 are presented. A study of the kinetics and mechanism of the reaction of N/sub 2/ with Nb is presented. A study of the U-Nb constitutional diagram is being performed. Data are reported on the fabrication of fueled graphite spheres. Materials of construction for use in the various proposed processes for the recovery of spent reactor fuel elements are being evaluated. Titanium is being investigated for the Darex Process dissolver, Carpenter 20Cb, Ni-o-nel, and Illium 98 for Thorex and Sulfex solutions, and INOR- 1 and INOR8 for the fluoride-volatility processes. Properties of UC are being determined. The preparation of an initial series of Ta and Ta-W alloys for Pu- alloy compatibility evaluation is in progress. A study to determine the effect of neutron irradiation on the mechanical properties of Ta is reported. (For preceding period see BMI-1294.) (W.L.H.)","","NTIS","Battelle Memorial Inst., Columbus, OH (United States)","Sponsor not identified","","United States","1958-11-01T00:00:00Z","English","Technical Report","Report","Other Information: Decl. June 12, 1959","","Medium: ED; Size: Pages: 58","","BMI-1301","W-7405-ENG-92","","10.2172/4852092","","2013-08-15T00:00:00Z","4852092","https://www.osti.gov/biblio/4852092","https://www.osti.gov/servlets/purl/4852092","","",""
"NEUTRON SOURCES FOR USE IN REACTOR STARTUP","de Saint Maurice, A B","PHYSICS; ANTIMONY; BERYLLIUM 8; BERYLLIUM 9; CRITICAL ASSEMBLIES; CRITICALITY; DEUTERIUM; HYDROGEN; MULTIPLICATION FACTORS; NEUTRON FLUX; NEUTRON SOURCES; PHOTOFISSION; PHOTONEUTRONS; POLONIUM; RESEARCH REACTORS; SHELLS; SHUTDOWN; STARTUP; WATER COOLANT; WATER MODERATOR; WTR","The particular properties of the Westinghouse Testing Reactor are used in the design of the neutron sources to be used both in its startup and in the critical experiments. Specifically the WTR is a high flux irradiation facility using highly enriched U/sup 235/ as fuel and light water as moderator and coolant. The amount of reactivity control is such that the shutdown multiplication is 0.85 under normal operating conditions. The sources considered are the D/sup 2/( gamma ,n)H/sup 1/ reaction, the Be/sup 9/( gamma ,n)Be/sup 8/ reaction Sb-Be coaxial neutron source, Sb-- Be homogeneous neutron source, and Po-- Be mixture neutron source. Discussions are included on the selection of neutron source type, subcritical flux determination, neutron source specification for the WTR critical, neutron flux varintion in the WTR, and neutron source containers. (M.H.R.)","","NTIS","Westinghouse Electric Corp. Commercial Atomic Power Activity, Pittsburgh","","","Country unknown/Code not available","1956-11-14T00:00:00Z","English","Technical Report","","Other Information: Orig. Receipt Date: 31-DEC-58","","Medium: X; Size: Pages: 24","","WCAP-382","","","","","2016-06-29T00:00:00Z","4340322","https://www.osti.gov/biblio/4340322","","","",""
"Reformer for Conversion of Diesel Fuel into CO and Hydrogen","Mundschau, Michael V; Gribble, Jr, David A; Plassmeyer, Paul N; Henton, Lee M; Jentzsch, Nicholas R","08 HYDROGEN; 30 DIRECT ENERGY CONVERSION; 37 INORGANIC, ORGANIC, PHYSICAL, AND ANALYTICAL CHEMISTRY; 54 ENVIRONMENTAL SCIENCES; Diesel-fuel reformer, sulfur-tolerant perovskite catalysts, syngas, solid-oxide fuel cells, catalytic membrane reactor, JP-8","","","","Eltron Research & Development Inc., Boulder, CO 80301-3241","USDOE Office of Fossil Energy (FE)","","United States","2010-02-05T00:00:00Z","English","Technical Report","","","Final","Medium: ED; Size: 7137 KB","","DOE/ER/84394-5","FG02-05ER84394","","","","2017-09-29T00:00:00Z","970983","https://www.osti.gov/biblio/970983","","","",""
"A solar model with low neutrino emission","Hoyle, F","N56400* -Physics (Astrophysics & Cosmology)-Solar Phenomena; *BERYLLIUM 7- COSMOCHEMISTRY; *BERYLLIUM 8- COSMOCHEMISTRY; *CHLORINE 37- COSMOCHEMISTRY; *HYDROGEN- COSMOCHEMISTRY; *SUN- SOLAR NEUTRINOS; CONVECTION; COSMOLOGY; GAMMA RADIATION; NUCLEAR REACTIONS; PROTONS","","","","California Institute of Technology, Pasadena","USDOE","","United States","1975-05-01T00:00:00Z","English","Journal Article","","Journal Name: Astrophys. J., Lett., v. 197, no. 3, pp. L127-L131; Other Information: Orig. Receipt Date: 31-DEC-75","","Medium: X","","","","Journal ID: AJLEA","10.1086/181793","","2016-05-05T00:00:00Z","4204997","https://www.osti.gov/biblio/4204997","","Astrophys. J., Lett., v. 197, no. 3, pp. L127-L131","",""
"Radiative collision of composite particles at low energy","Frois, B","N68251* -Physics (Nuclear, Experimental)-Nuclear Properties & Reactions, A <= 5-Nuclear Reactions & Scattering; N64110 -Physics (High Energy)-Particle Interactions & Properties (Experimental)-Electromagnetic; ALPHA REACTIONS- BERYLLIUM 8- HELIUM 4; BREMSSTRAHLUNG; COULOMB CORRECTION- HYDROGEN 1- PROTON REACTIONS; CROSS SECTIONS; LABORATORY SYSTEM; MEV RANGE 01-10; MEV RANGE 10-100; RADIATIVE CORRECTIONS; RESCATTERING; S MATRIX HELIUM 3 REACTIONS- HELIUM 4","","","INIS","Paris-11 Univ., 91 - Orsay (France)","","","France","1974-01-01T00:00:00Z","French","Technical Report","","Other Information: Orig. Receipt Date: 31-DEC-75","","Medium: X; Size: Pages: 79","","FRNC-TH-522","","","","","2008-02-05T00:00:00Z","4196104","https://www.osti.gov/biblio/4196104","","","",""
"Mechanical tests for welded zones and welding beads.","Poirier, J; Fidelle, J P; Roux, C","N50230* -Metals, Ceramics, & Other Materials-Metals & Alloys-Properties, Structure & Phase Studies; CYLINDERS- ELECTRON BEAM WELDING- FUEL CANS- HYDROGEN- MECHANICAL TESTS- RUPTURES- STAINLESS STEELS- VERY HIGH PRESSURE; CYLINDERS- ELECTRON BEAM WELDING- HYDROGEN- MECHANICAL TESTS- MOLYBDENUM ALLOYS- RUPTURES- URANIUM BASE ALLOYS- VERY HIGH PRESSURE; CYLINDERS- ELECTRON BEAM WELDING- HYDROGEN- MECHANICAL TESTS- RUPTURES- URANIUM BASE ALLOYS- VANADIUM ADDITIONS- VERY HIGH PRESSURE; VANADIUM ALLOYS AND SYSTEMS/U-base-V, plasticity of electron-beam welds of dilute, test method for; WELDS/plasticity of electron- beam, method for measurement of; URANIUM ALLOYS AND SYSTEMS/Mo-U-base, plasticity of electron-beam welds of dilute, test method for; STAINLESS STEEL/ plasticity of electron-beam welds of Type 18-8, test method for; MOLYBDENUM ALLOYS AND SYSTEMS/Mo-U-base, plasticity of electron-beam welds of dilute, test method for; URANIUM ALLOYS AND SYSTEMS/U-base-V, plasticity of electron-beam welds of dilute, test method for","","","","Centre d'Etudes de Bruyeres-le-Chatel, Montrouge, France","","","France","1973-04-30T00:00:00Z","English","Journal Article","","Journal Name: pp 529-543 of Electron Beam Welding and Melting. Paris Interbus, 1971.; Other Information: From 1. international conference on electron beam welding and melting, Paris, France, 16 Jun 1970. See CONF-700676--. In Electron Beam Welding and Melting. Orig. Receipt Date: 30-JUN-73","","Medium: X","","","","","","","2009-12-14T00:00:00Z","4594626","https://www.osti.gov/biblio/4594626","","pp 529-543 of Electron Beam Welding and Melting. Paris Interbus, 1971.","",""
"CHARGE TRANSFER IN H$sup +$--H$sup -$ COLLISIONS.","Roy, K; Mukherjee, S C","N60400* -Physics (Atomic & Molecular)-Collision Phenomena; CHARGE EXCHANGE; COLLISIONS; EV RANGE 100-1000; EXCITED STATES; HYDROGEN IONS 1 MINUS; HYDROGEN IONS 1 PLUS; ION COLLISIONS; KEV RANGE 01-10; TOTAL CROSS SECTIONS; WAVE FUNCTIONS; HYDROGEN IONS (H$sup +$)/reactions with hydrogen ions (H$sup -$) at 0.5 to 8 keV, charge transfer cross sections for, (T); HYDROGEN IONS (H$sup -$)/reactions with hydrogen ions (H$sup +$) at 0.5 to 8 keV, charge transfer cross sections for, (T)","","","","Indian Association for the Cultivation of Science, Calcutta","USDOE","","Country unknown/Code not available","1973-01-01T00:00:00Z","English","Journal Article","","Journal Name: Phys. Rev., A 7: No. 1, 130-134(Jan 1973).; Other Information: Orig. Receipt Date: 30-JUN-73","","Medium: X","","","","Journal ID: PLRAA","10.1103/PhysRevA.7.130","","2016-05-19T00:00:00Z","4618273","https://www.osti.gov/biblio/4618273","","Phys. Rev., A 7: No. 1, 130-134(Jan 1973).","",""
"Three- and four-pion angular correlations in high-multiplicity $pi$p interactions.","Aachen-Berlin-Bonn-CERN-Krakow-Heidelberg-Warsaw, C.","N64140* -Physics (High Energy)-Particle Interactions & Properties (Experimental)-Strong (Meson-induced); ANGULAR CORRELATION; BUBBLE CHAMBERS; GEV RANGE 01-10; GEV RANGE 10- 100; LINEAR MOMENTUM; MULTIPLICITY; PION-PROTON INTERACTIONS; PIONS; PIONS MINUS; PIONS PLUS; PROTONS/interactions $pi$$sup -$ + p at 16 GeV/c in hydrogen bubble chamber, three- and four-pion angular correlations in high multiplicity, (E); MESONS ($pi$$sup -$)/interactions $pi$$sup -$ + p at 16 GeV/c in hydrogen bubble chamber, three- and four-pion angular correlations in high multiplicity, (E); PROTONS/interactions $pi$$sup +$ + p at 8 GeV/c in hydrogen bubble chamber, three- and four-pion angular correlations in high multiplicity, (E); MESONS ($pi$$sup +$)/interactions $pi$$sup +$ + p at 8 GeV/c in hydrogen bubble chamber, three- and four-pion angular correlations in high multiplicity, (E)","","","","Originating Research Org. not identified","","","Country unknown/Code not available","1973-01-01T00:00:00Z","English","Journal Article","","Journal Name: Nucl. Phys., B B52: No. 1, 189-202(1973).; Other Information: Orig. Receipt Date: 30-JUN-73","","Medium: X","","","","","","","2009-12-15T00:00:00Z","4608165","https://www.osti.gov/biblio/4608165","","Nucl. Phys., B B52: No. 1, 189-202(1973).","",""
