"TITLE","AUTHORS","SUBJECT","DESCRIPTION","PUBLISHER","AVAILABILITY","RESEARCH_ORG","SPONSORING_ORG","CONTRIBUTING_ORG","PUBLICATION_COUNTRY","PUBLICATION_DATE","LANGUAGE","RESOURCE_TYPE","TYPE_QUALIFIER","RELATION","COVERAGE","FORMAT","IDENTIFIER","REPORT_NUMBER","DOE_CONTRACT_NUMBER","OTHER_IDENTIFIER","DOI","RIGHTS","ENTRY_DATE","OSTI_IDENTIFIER","CITATION_URL","PURL_URL","JOURNAL_NAME","JOURNAL_ISSUE","JOURNAL_VOLUME"
"EQUILIBRIUM CHARGE-STATE DISTRIBUTIONS OF HEAVY IONS (1 TO 14 MeV).","Wittkower, A B; Ryding, G","N32240* -Physics-Atomic & Molecular Physics-Collision Phenomena; ARGON- CHLORINE- HELIUM- HYDROGEN- KRYPTON- NITROGEN- OXYGEN; CARBON; CARBON DIOXIDE- GOLD- IODINE- XENON; DISTRIBUTION; ELECTRIC CHARGES; FOILS; GASES; HEAVY IONS; ION BEAMS; IONIZATION; MEV RANGE 01-10; MEV RANGE 10-100 ARGON- BROMINE- HELIUM- HYDROGEN- KRYPTON- NITROGEN; OXYGEN/ion reactions at 1 to 14 MeV with molecular, equilibrium charge-state distributions from heavy-, (E); NITROGEN/ion reactions at 1 to 14 MeV with molecular, equilibrium charge-state distributions from heavy- , (E); HELIUM/ion reactions at 1 to 14 MeV with, equilibrium charge-state distributions from heavy-, (E); ARGON/ion reactions at 1 to 14 MeV with, equilibrium charge-state distributions from heavy-, (E); KRYPTON/ion reactions at 1 to 14 MeV with, equilibrium charge-state distributions from heavy-, (E); CARBON DIOXIDES/iodine-ion reactions at 8 MeV with, equilibrium charge-state distributions from, (E); GOLD/iodine-ion reactions at 10 and 12 MeV with foils of, equilibrium charge-state distributions from, (E); HYDROGEN/ion reactions at 1 to 14 MeV with molecular, equilibrium charge-state distributions from heavy-, (E); CHLORINE IONS/reactions with carbon foils and gases at 1 to 14 MeV, equilibrium charge-state distributions from, (E); BROMINE IONS/reactions with carbon foils an","","","","High Voltage Engineering Corp., Burlington, Mass.","USDOE","","Country unknown/Code not available","1971-01-01T00:00:00Z","English","Journal Article","","Journal Name: Phys. Rev., A 4: No. 1, 226-32(1 Jul 1971).; Other Information: Orig. Receipt Date: 31-DEC-71","","Medium: X","","","","","10.1103/PhysRevA.4.226","","2016-05-25T00:00:00Z","4040110","https://www.osti.gov/biblio/4040110","","Phys. Rev., A 4: No. 1, 226-32(1 Jul 1971).","",""
"FORWARD COMPTON SCATTERING FROM HYDROGEN AND DEUTERIUM AT 8 AND 16 GeV.","Boyarski, A M; Coward, D H; Ecklund, S","N34110* -Physics (High Energy)-Particle Interactions & Properties (Experimental)-Electromagnetic; COMPTON EFFECT; CROSS SECTIONS; DEUTERIUM; GEV RANGE 01-10; GEV RANGE 10-100; HYDROGEN; INTERACTIONS; NEUTRONS; PHOTONS; PROTONS; VECTOR DOMINANCE MODEL; DEUTERONS/interactions $gamma$ + d at 8 and 16 GeV, cross sections for forward Compton, (E); PROTONS/interactions $gamma$ + p at 8 and 16 GeV, cross sections for forward Compton, (E); PHOTONS/interactions $gamma$ + p at 8 and 16 GeV, cross sections for forward Compton, (E); PHOTONS/ interactions $gamma$ + d at 8 and 16 GeV, cross sections for forward Compton, (E)","","","","Stanford Univ., CA (United States); and others","","","Country unknown/Code not available","1971-01-01T00:00:00Z","English","Journal Article","","Journal Name: Phys. Rev. Lett. 26: No. 25, 1600-3(21 Jun 1971).; Other Information: Orig. Receipt Date: 31-DEC-71","","Medium: X","","","","","10.1103/PhysRevLett.26.1600","","2009-12-14T00:00:00Z","4033363","https://www.osti.gov/biblio/4033363","","Phys. Rev. Lett. 26: No. 25, 1600-3(21 Jun 1971).","",""
"$sup 8$B PRODUCTION IN THE CAPTURE OF STOPPED $pi$-MESONS BY NITROGEN NUCLEI.","Agababian, N M; Batusov, Yu A; Bunyatov, S A; Gulkanian, H R; Sidorov, V M; Yarba, V A","N36350* -Physics (Nuclear)-Nuclear Properties & Reactions, 6 <= A <= 19-Nuclear Reactions & Scattering; BORON 8; BOUND STATE; CAPTURE; HYDROGEN 6; NEUTRONS; NITROGEN 14; NUCLEAR REACTIONS; PIONS-MINUS; PRODUCTION; NITROGEN ISOTOPES N-14/meson ($pi$$sup -$) capture at rest, boron-8 production and upper limits for hydrogen-6, and n$sup 3$, n$sup 4$, and n$sup 5$ bound multineutron state production in, (E); BORON ISOTOPES B-8/ production in meson ($pi$$sup -$) capture by nitrogen-14 at rest, (E); TRINEUTRONS/production in meson ($pi$$sup -$) capture by nitrogen-14 at rest, upper limits for, (E); TETRANEUTRONS/production in meson ($pi$$sup -$) capture by nitrogen-14 at rest, upper limits for, (E); MESONS ($pi$$sup -$)/capture by nitrogen-14 at rest, boron-8 production and upper limits for hydrogen-6, and n$sup 3$, n$sup 4$, and n$sup 5$ bound multineutron state production in, (E); HYDROGEN ISOTOPES H-6/production in meson ($pi$$sup -$) capture by nitrogen-14 at rest, upper limits for, (E)","","","Dep. NTIS (U. S. Sales Only).","Joint Inst. for Nuclear Research, Dubna (USSR). Lab. of Nuclear Problems","","","USSR","1971-01-01T00:00:00Z","Russian","Technical Report","","Other Information: UNCL. Orig. Receipt Date: 31-DEC-72","","Medium: X; Size: Pages: 8","","JINR-P1-5892","","","","","2010-06-03T00:00:00Z","4709874","https://www.osti.gov/biblio/4709874","","","",""
"HYDROGEN DENSITY AND PROTON FLUX IN THE TOPSIDE IONOSPHERE OVER ARECIBO, PUERTO RICO, FROM INCOHERENT SCATTER OBSERVATIONS.","Ho, M C; Moorcroft, D R","N32610* -Physics (Atmospheric)-Auroral & Ionospheric Phenomena; ANGULAR DISTRIBUTION; CATIONS; DENSITY; DISTRIBUTION; DIURNAL VARIATION; DOSE RATES; ELECTRON TEMPERATURE; F-LAYER; HELIUM COMPOUNDS; HYDROGEN; HYDROGEN COMPOUNDS; ION DENSITY; ION TEMPERATURE; LEVELS; MATHEMATICAL MODELS; MOTION; NEUTRAL PARTICLES; OXYGEN COMPOUNDS; PROTON BEAMS; PROTONS; PUERTO RICO; RADIO WAVES; SCATTERING; TEMPERATURE; WAVE PROPAGATION; HYDROGEN/density in topside ionosphere, Dec. 7 and 8, 1965 incoherent scatter observations of neutral, (E); PROTONS/flux in topside ionosphere, Dec. 7 and 8 1965 incoherent scatter observations of, (E); IONOSPHERE/ proton flux in topside, Dec. 7 and 8, 1965 incoherent scatter observations of, (E); IONOSPHERE/hydrogen density in topside, Dec. 7 and 8, 1965 incoherent scatter observations of neutral, (E)","","","","Univ. of Western Ontario, London","","","United Kingdom","1971-01-01T00:00:00Z","English","Journal Article","","Journal Name: Planet. Space Sci. 19: No. 11, 1441-55(Nov 1971).; Other Information: Orig. Receipt Date: 31-DEC-72; Bib. Info. Source: UK (United Kingdom (sent to DOE from))","","Medium: X","","","","","10.1016/0032-0633(71)90005-5","","2009-12-14T00:00:00Z","4722173","https://www.osti.gov/biblio/4722173","","Planet. Space Sci. 19: No. 11, 1441-55(Nov 1971).","",""
"ALGEBRAIC DETERMINATION OF ELECTRON--NUCLEAR AND ELECTRON--ELECTRON DISTRIBUTION FUNCTIONS FROM HYLLERAAS-TYPE WAVE FUNCTIONS.","Benesch, R","N32250* -Physics-Atomic & Molecular Physics-Atomic Theory; N32220 -Physics-Atomic & Molecular Physics-Atomic & Molecular Properties; ALGEBRA; ANGULAR DISTRIBUTION; ANIONS; ATOMIC MODELS; BORON COMPOUNDS; CATIONS; COMPUTER CALCULATIONS; DENSITY MATRIX; DISTRIBUTION; ELECTRONS; ENERGY; EXPECTATION VALUE; GROUND STATE; HELIUM; HELIUM COMPOUNDS; HYDROGEN COMPOUNDS; IONIZATION; IONS; LITHIUM COMPOUNDS; MAGNESIUM COMPOUNDS; NEON COMPOUNDS; NUCLEI; NUMERICAL SOLUTION; OPERATORS; OXYGEN COMPOUNDS; S-STATES; SERIES EXPANSION; VALENCE; OXYGEN IONS/electron radial distribution in O$sup 6+$, calculation using Hylleraas-type wave functions; HYDROGEN IONS (H$sup -$)/ electron radial distribution in, calculation using Hylleraas-type wave functions; LITHIUM IONS/electron radial distribution in Li$sup +$, calculation using Hylleraas-type wave functions; BORON IONS/electron radial distribution in B$sup 3+$, calculation using Hylleraas-type wave functions; NEON IONS/electron radial distribution in Ne$sup 8+$, calculation using Hylleraas-type wave functions; MAGNESIUM IONS/electron radial distribution in Mg$sup 10+$, calculation using Hylleraas-type wave functions; ATOMS/electron radial distribution in, calculation using Hylleraas-type wave functions; HELIUM/electron radial distribution in, calculation using Hylleraas-type wave functions","","","","Univ. of Waterloo, Ont.","","","United Kingdom","1971-01-01T00:00:00Z","English","Journal Article","","Journal Name: J. Phys., B (London) 4: No. 11, 1403-14(Nov 1971).; Other Information: Orig. Receipt Date: 31-DEC-72; Bib. Info. Source: UK (United Kingdom (sent to DOE from))","","Medium: X","","","","","","","2009-12-14T00:00:00Z","4702656","https://www.osti.gov/biblio/4702656","","J. Phys., B (London) 4: No. 11, 1403-14(Nov 1971).","",""
"DEVELOPMENT OF FUEL ELEMENT FABRICATION.","Adamson, Jr, G M","N30220* -Metals, Ceramics, & Other Materials-Ceramics & Cermets-Preparation & Fabrication; N30120 -Metals, Ceramics, & Other Materials-Metals & Alloys-Preparation & Fabrication; N38700 -Reactor Components, Fuels & Accessories; ACCELERATORS- ALUMINUM- BUBBLES- DEFECTS- FABRICATION- FUEL ELEMENTS- HYDROGEN- IONS- MOCKUP- PLATES- RADIATION EFFECTS- TESTING- VELOCITY; ALUMINUM- DENSITY- FUEL ELEMENTS- IRRADIATION- PLATES- POWDER METALLURGY- RADIATION EFFECTS- RADIOGRAPHY- REACTOR CORE- RESEARCH REACTORS- TESTING- U3O8- WELDING; ALUMINUM- DISPERSIONS- FUEL ELEMENTS- PARTICLES- PREPARATION- URANIUM- ZIRCONIUM OXIDES; HYDROGEN/effects of cyclotron-injected, on blistering in powder metallurgy aluminum plates; ORNL HIGH-FLUX ISOTOPE REACTOR/fuel elements for, fabrication of increased fuel loaded; REACTOR FUEL ELEMENTS/ fabrication of aluminum plate-type, for blistering testing in simulated HFIR elements; ALUMINUM ALLOYS AND SYSTEMS/Al-U$sub 3$O$sub 8$, fabrication of dispersion fuel plates of, for irradiation in ETR; URANIUM OXIDES U$sub 3$O$sub 8$/Al-U$sub 3$O$sub 8$, fabrication of dispersion fuel plates of, for irradiation in ETR; ALUMINUM ALLOYS AND SYSTEMS/Al-U$sub 3$O$sub 8$, radiation effects on fuel plates of, in-pile; REACTOR FUEL ELEMENTS/density of aluminum- uranium oxide dispersion-type, radiographic determination of; URANIUM ALLOYS AND SYSTEMS/Al-U-base-ZrO$sub 2$, fabrication of void-containing boron carbide poisoned fuel plates of, method for; ALUMINUM/radiation effects on powder metallurgy plates of, cyclotron-injected hydrogen; URANIUM OXIDES U$sub 3$O$sub 8$/Al-U$sub 3$O$sub 8","","","","Oak Ridge National Lab., Tenn.","","","United States","1970-10-31T00:00:00Z","English","Technical Report","","Other Information: UNCL. Orig. Receipt Date: 31-DEC-70","","Medium: X","","ORNL-4440","","","","","2008-02-05T00:00:00Z","4747218","https://www.osti.gov/biblio/4747218","","","",""
"$lambda$ K PRODUCTION IN FOUR-PRONG $pi$$sup +$p INTERACTIONS AT 8 GeV/c.","Balea, E; Balea, O; Mihul, A; Sabau, M","N34140* -Physics (High Energy)-Particle Interactions & Properties (Experimental)-Strong (Meson-induced); ANGULAR DISTRIBUTION; BUBBLE CHAMBERS; CROSS SECTIONS; DISTRIBUTION; GEV RANGE 01-10; INTERACTIONS; K*RESONANCES; MASS; MOMENTUM; PIONS-PLUS; PRODUCTION; PROTONS; RHO RESONANCES; WIDTH; Y*RESONANCES; HYPERONS ($lambda$)/production in $pi$$sup +$ + p interactions at 8 GeV/c in hydrogen bubble chamber, momentum and angular distributions for, (E); PROTONS/interactions $pi$$sup +$ + p at 8 GeV/c in hydrogen bubble chamber, mass distributions and cross sections for resonance production and momentum and angular distributions for, (E); MESONS, RESONANCE/ production of K(890) in $pi$$sup +$ + p interactions at 8 GeV/c in hydrogen bubble chamber, cross sections for, (E); MESONS (rho)/production in $pi$$sup +$ + p interactions at 8 GeV/c in hydrogen bubble chamber, (E); MESONS (K)/production in $pi$$sup +$ + p interactions at 8 GeV/c in hydrogen bubble chamber, momentum and angular distributions for, (E); BARYONS, RESONANCE (Y*)/production of $Sigma$$sup +$(1385), $Sigma$$sup -$(1385), and $lambda$$pi$$sup +$(2000) and $lambda$K(1800) enhancements in $pi$$sup +$ + p interactions at 8 GeV/c in hydrogen bubble chamber, cross sections for, (E); MESONS ($pi$)/production in $pi$$sup +$ + p intera","","","Dep. NTIS (U. S. Sales Only).","Institutul de Fizica Atomica, Bucharest (Romania)","","","Country unknown/Code not available","1970-01-01T00:00:00Z","English","Technical Report","","Other Information: UNCL. Orig. Receipt Date: 31-DEC-71","","Medium: X; Size: Pages: 14","","IFA-HE-73","","","","","2008-02-05T00:00:00Z","4742567","https://www.osti.gov/biblio/4742567","","","",""
"K anti K PRODUCTION IN FOUR-PRONG $pi$$sup +$p INTERACTIONS AT 8 GeV/c.","Balea, E; Balea, O; Mihul, A; Sabau, M","N34140* -Physics (High Energy)-Particle Interactions & Properties (Experimental)-Strong (Meson-induced); BUBBLE CHAMBERS; CROSS SECTIONS; GEV RANGE 01-10; INTERACTIONS; K*RESONANCES; MASS; MOMENTUM; N*RESONANCES; PIONS-PLUS; PRODUCTION; PROTONS; WIDTH; PROTONS/interactions $pi$$sup +$ + p at 8 GeV/c in hydrogen bubble chamber, cross sections, kinematical behavior of secondaries, and K-anti K pairs and resonance production in four-prong, (E); MESONS ($pi$$sup +$)/ interactions $pi$$sup +$ + p at 8 GeV/c in hydrogen bubble chamber, cross sections, kinematical behavior of secondaries, and K-anti K pairs and resonance production in four-prong, (E); MESONS (K)/production in four-prong $pi$$sup +$ + p interactions at 8 GeV/c in hydrogen bubble chamber, angular and momentum distributions for, (E); MESONS ($pi$)/production in four-prong $pi$$sup +$ + p interactions at 8 GeV/c in hydrogen bubble chamber, angular and momentum distributions for, (E); BARYONS, RESONANCE (N*)/mass and width of N(1470) in four- prong $pi$$sup +$ + p interactions at 8 GeV/c in hydrogen bubble chamber, (E); NUCLEONS/production in four-prong $pi$$sup +$ + p interactions at 8 GeV/c in hydrogen bubble chamber, angular and momentum distributions for, (E); MESONS (K)/","","","Dep. NTIS (U. S. Sales Only).","Institutul de Fizica Atomica, Bucharest (Romania)","","","Country unknown/Code not available","1970-01-01T00:00:00Z","English","Technical Report","","Other Information: UNCL. Orig. Receipt Date: 31-DEC-71","","Medium: X; Size: Pages: 17","","IFA-HE-75","","","","","2008-02-05T00:00:00Z","4721255","https://www.osti.gov/biblio/4721255","","","",""
"CORRELATION BETWEEN TRANSVERSE AND LONGITUDINAL MOMENTA OF SECONDARIES IN 8 GeV/c $pi$$sup +$p INTERACTIONS.","Balea, E; Balea, O; Mihul, A; Sabu, M","N34140* -Physics (High Energy)-Particle Interactions & Properties (Experimental)-Strong (Meson-induced); GEV RANGE; GEV RANGE 01-10; INTERACTIONS; KAONS; LAMBDA PARTICLES; MOMENTUM; PIONS; PIONS-PLUS; PRODUCTION; PROTONS; PROTONS/production in $pi$$sup +$ + p interactions at 8 GeV/c in hydrogen bubble chamber, correlation between transverse and longitudinal momenta in, (E); MESONS ($pi$)/production in $pi$$sup +$ + p interactions at 8 GeV/c in hydrogen bubble chamber, correlation between transverse and longitudinal momenta in, (E); MESONS ($pi$$sup +$)/interactions $pi$$sup +$ + p at 8 GeV/c in hydrogen bubble chamber, correlation between transverse and longitudinal momenta of $pi$, K, p, and $lambda$ secondaries in, (E); HYPERONS ($lambda$)/production in $pi$$sup +$ + p interactions at 8 GeV/c in hydrogen bubble chamber, correlation between transverse and longitudinal momenta in, (E); MESONS (K)/production in $pi$$sup +$ + p interactions at 8 GeV/c in hydrogen bubble chamber, correlation between transverse and longitudinal momenta in, (E); PROTONS/interactions $pi$$sup +$ + p at 8 GeV/c in hydrogen bubble chamber, correlation between transverse and longitudinal momenta of $pi$, K, p, and $lambda$ secon","","","","Inst. of Atomic Physics, Bucharest","","","Country unknown/Code not available","1970-01-01T00:00:00Z","English","Journal Article","","Journal Name: Rev. Roum. Phys. 15: 233-6(1970).; Other Information: Orig. Receipt Date: 31-DEC-70","","Medium: X","","","","","","","2009-12-14T00:00:00Z","4115259","https://www.osti.gov/biblio/4115259","","Rev. Roum. Phys. 15: 233-6(1970).","",""
"REDUCTION OF THE COMPACT U$sub 3$O$sub 8$ BY HYDROGEN.","Dymkov, Yu M; Nazarenko, N G; Dymkova, G A; Gorynov, E F","N30240* -Metals, Ceramics, & Other Materials-Ceramics & Cermets-Structure & Phase Studies; CHEMICAL REACTIONS; COMPACTING; COMPACTS; CRYSTALS; HIGH TEMPERATURE; HYDROGEN; LATTICES; REDUCTION; U3O8; URANIUM OXIDES U$sub 3$O$sub 8$/reduction of compacts of, by hydrogen at 500$sup 0$C, crystal structure of phases formed during; HYDROGEN/reactions with uranium oxide compacts at 500$sup 0$C, crystal structure of phases formed during reduction","","","","Originating Research Org. not identified","","","Country unknown/Code not available","1970-01-01T00:00:00Z","Russian","Journal Article","","Journal Name: At. Energ. (USSR) 28: 426-8(1970).; Other Information: Orig. Receipt Date: 31-DEC-70; Bib. Info. Source: TTT (Tenn. Tech. Trans.)","","Medium: X","","","","","","","2009-12-14T00:00:00Z","4104006","https://www.osti.gov/biblio/4104006","","At. Energ. (USSR) 28: 426-8(1970).","",""
"$lambda$K PRODUCTION IN FOUR-PRONG $pi$$sup +$p INTERACTIONS AT 8 GeV/c.","Balea, E; Balea, O; Mihul, A; Sabau, M","N34140* -Physics (High Energy)-Particle Interactions & Properties (Experimental)-Strong (Meson-induced); ANGULAR DISTRIBUTION; BUBBLE CHAMBERS; GEV RANGE 01-10; INTERACTIONS; K*RESONANCES; LAMBDA PARTICLES; MOMENTUM; PIONS; PIONS-PLUS; PRODUCTION; PROTONS; RHO RESONANCES; Y1*RESONANCES; MESONS ($pi$)/production in four-prong $pi$$sup +$ + p interactions at 8 GeV/c in hydrogen bubble chamber, angular distributions for, (E); MESONS (rho)/production in four-prong $pi$$sup +$ + p interactions at 8 GeV/ c in hydrogen bubble chamber, (E); PROTONS/interactions $pi$$sup +$ + p at 8 GeV/ c in hydrogen bubble chamber, angular distributions for $lambda$, K, and $pi$ production and $Sigma$(1385), K(890), and rho production in four-prong, (E); MESONS (K)/production in four-prong $pi$$sup +$ + p interactions at 8 GeV/c in hydrogen bubble chamber, angular distributions for, (E); MESONS ($pi$$sup +$)/ interactions $pi$$sup +$ + p at 8 GeV/c in hydrogen bubble chamber, angular distributions for $lambda$, K, and $pi$ production and $Sigma$(1385), K(890), and rho production in four-prong, (E); BARYONS, RESONANCE (Y*)/production of $Sigma$(1385) in four-prong $pi$$sup +$ + p interactions at 8 GeV/c in hydrogen bubble chamber, (E); MESONS, RESONANCE/production of K*(890) in four-prong $pi","","","","Inst. of Atomic Physics, Bucharest","","","Country unknown/Code not available","1970-01-01T00:00:00Z","English","Journal Article","","Journal Name: Rev. Roum. Phys. 15: 1021-8(1970).; Other Information: Orig. Receipt Date: 31-DEC-71","","Medium: X","","","","","","","2009-12-14T00:00:00Z","4038345","https://www.osti.gov/biblio/4038345","","Rev. Roum. Phys. 15: 1021-8(1970).","",""
"K anti K PRODUCTION IN FOUR-PRONG $pi$$sup +$p INTERACTIONS AT 8 GeV/c.","Balea, E; Balea, O; Mihul, A; Sabau, M","N34140* -Physics (High Energy)-Particle Interactions & Properties (Experimental)-Strong (Meson-induced); A RESONANCES; A2 RESONANCES; ANTIKAONS; BUBBLE CHAMBERS; GEV RANGE 01- 10; INTERACTIONS; K*RESONANCES; KAONS; MOMENTUM; PAIR PRODUCTION; PIONS-PLUS; PRODUCTION; PROTONS; MESONS, RESONANCE/production of K*(890), anti K*(890), A$sub 2$(1325), and A$sub 1$.$sub 5$(1170) in four-prong $pi$$sup +$ + p interactions at 8 GeV/c in hydrogen bubble chamber, (E); PROTONS/interactions $pi$$sup +$ + p at 8 GeV/c in hydrogen bubble chamber, K-anti K pair and resonance production in four-prong, <E); BARYONS, RESONANCE (N*)/production of $delta$(1236), N(1470), and $delta$(1640) in four-prong $pi$$sup +$ + p interactions at 8 GeV/c in hydrogen bubble chamber, (E); MESONS ($pi$$sup +$)/ interactions $pi$$sup +$ + p at 8 GeV/c in hydrogen bubble chamber, K-anti K pair and resonance production in four-prong, <E); MESONS (K)/production of K- anti K pairs in four-prong $pi$$sup +$ + p interactions at 8 GeV/c in hydrogen bubble chamber, (E)","","","","Inst. of Atomic Physics, Bucharest","","","Country unknown/Code not available","1970-01-01T00:00:00Z","English","Journal Article","","Journal Name: Rev. Roum. Phys. 15: 1085-92(1970).; Other Information: Orig. Receipt Date: 31-DEC-71","","Medium: X","","","","","","","2009-12-14T00:00:00Z","4038346","https://www.osti.gov/biblio/4038346","","Rev. Roum. Phys. 15: 1085-92(1970).","",""
"PION PRODUCTION MECHANISM IN HIGH MULTIPLICITY $pi$$sup +$p INTERACTIONS AT 8 GeV/c.","Coghen, T; Czyzewski, O; Eskreys, A","N34140* -Physics (High Energy)-Particle Interactions & Properties (Experimental)-Strong (Meson-induced); BUBBLE CHAMBERS; GEV RANGE 01-10; INTERACTIONS; MOMENTUM; NEUTRONS; PIONS; PIONS-MINUS; PIONS-NEUTRAL; PIONS-PLUS; PRODUCTION; PROTONS; MESONS ($pi$$sup +$)/interactions $pi$$sup +$ + p $Yields$ n + 5$pi$$sup +$ + 3$pi$$sup -$ at 8 GeV/c in hydrogen bubble chamber, $pi$ production mechanism for, (E); MESONS ($pi$)/production in $pi$$sup +$ + p interactions at 8 GeV/c in hydrogen bubble chamber, mechanism for, (E); PROTONS/ interactions $pi$$sup +$ + p $Yields$ p + 4$pi$$sup +$ + 3$pi$$sup -$ at 8 GeV/c in hydrogen bubble chamber, $pi$ production mechanism for, (E); MESONS ($pi$$sup +$)/interactions $pi$$sup +$ + p $Yields$ p + 4$pi$$sup +$ + 3$pi$$sup -$ + $pi$$sup 0$ at 8 GeV/c in hydrogen bubble chamber, $pi$ production mechanism for, (E); MESONS ($pi$$sup +$)/interactions $pi$$sup +$ + p $Yields$ p + 4$pi$$sup +$ + 3$pi$$sup -$ at 8 GeV/c in hydrogen bubble chamber, $pi$ production mechanism for, (E); PROTONS/interactions $pi$$sup +$ + p $Yields$ n + 5$pi$$sup +$ + 3$pi$$sup -$ at 8 GeV/c in hydrogen bubble chamber, $pi$ production mechanism for, (E); PROTONS/interactions $pi$$sup +$ + p $Yields$ p + 4$pi$$sup +$ +","","","Dep. NTIS (U. S. Sales Only).","and others; Institute of Nuclear Physics, Krakow (Poland)","","","Country unknown/Code not available","1970-01-01T00:00:00Z","English","Technical Report","","Other Information: From 15th International Conference on High Energy Physics, Kiev, USSR. UNCL. Orig. Receipt Date: 31-DEC-71","","Medium: X; Size: Pages: 23","","INP-708; CONF-700806-55","","","","","2012-12-12T00:00:00Z","4054874","https://www.osti.gov/biblio/4054874","","","",""
"DIURNAL VARIATION OF THE EXOSPHERIC NEUTRAL HYDROGEN TEMPERATURE.","Metzger, P H; Clark, M A","N32610* -Physics (Atmospheric)-Auroral & Ionospheric Phenomena; DOPPLER REACTIVITY; EARTH; EQUATOR; HYDROGEN; IONOSPHERE; LYMAN LINES; SPECTRA; TEMPERATURE; THERMOSPHERE; ZONES; EXOSPHERE/hydrogen temperature of, June 8, 1969, mean diurnal, (E); HYDROGEN/temperature of exospheric, June 8, 1969, mean diurnal, (E)","","","","Aerospace Corp., Los Angeles","USDOE","","Country unknown/Code not available","1970-01-01T00:00:00Z","English","Journal Article","","Journal Name: J. Geophys. Res. 75: 5587-91(1 Oct 1970).; Other Information: Orig. Receipt Date: 31-DEC-70","","Medium: X","","","","","10.1029/JA075i028p05587","","2016-05-05T00:00:00Z","4104526","https://www.osti.gov/biblio/4104526","","J. Geophys. Res. 75: 5587-91(1 Oct 1970).","",""
"THE POLARIZATION OF VARIABLE RADIO SOURCES AT 8 GHz. I. THE OBSERVATIONS.","Aller, H D","N32130* -Physics-Astrophysics-Quasi-stellar, Radio & X- Ray Sources; COSMIC RADIO SOURCES; CYCLOTRON RADIATION; FREQUENCY; HYDROGEN; IONS; POLARIZATION; VARIATIONS; COSMIC RADIO SOURCES/polarization of variable, at 8 GHz, (E); HII REGIONS/polarization at 8 GHz, (E)","","","","Univ. of Michigan, Ann Arbor","USDOE","","Country unknown/Code not available","1970-01-01T00:00:00Z","English","Journal Article","","Journal Name: Astrophys. J. 161: 1-18(Jul 1970).; Other Information: Orig. Receipt Date: 31-DEC-70","","Medium: X","","","","","10.1086/150508","","2016-05-16T00:00:00Z","4119173","https://www.osti.gov/biblio/4119173","","Astrophys. J. 161: 1-18(Jul 1970).","",""
"MEASUREMENT OF THE CHARGE EXCHANGE CROSS SECTION IN He$sup +$--H$sup -$ COLLISIONS.","Gaily, T D; Harrison, M F.A.","N32240* -Physics-Atomic & Molecular Physics-Collision Phenomena; ANIONS; ATOMS; CATIONS; CHARGE EXCHANGE; CROSS SECTIONS; ELECTRIC CHARGES; EV RANGE; EV RANGE 100-1000; HELIUM; HYDROGEN; INTERACTIONS; ION BEAMS; KEV RANGE; KEV RANGE 01-10; VELOCITY; HYDROGEN IONS (H$sup -$)/reactions with helium ions (He$sup +$) at 0.2 to 8 keV, inclined-beams measurement of cross sections for charge exchange in; CROSS SECTIONS/charge-exchange, for reactions between helium ions (He$sup +$) and hydrogen ions (H$sup -$) at 0.2 to 8 keV, inclined-beams measurement of; HELIUM IONS/reactions with hydrogen ions (H$sup -$) at 0.2 to 8 keV, inclined-beams measurement of cross section for charge exchange in","","","","United Kingdom Atomic Energy Authority, Abingdon, Eng.","","","United Kingdom","1970-01-01T00:00:00Z","English","Journal Article","","Journal Name: J. Phys., B (London) 3: 1098-1104(Aug 1970).; Other Information: Orig. Receipt Date: 31-DEC-70; Bib. Info. Source: UK (United Kingdom (sent to DOE from))","","Medium: X","","","","","","","2009-12-14T00:00:00Z","4115828","https://www.osti.gov/biblio/4115828","","J. Phys., B (London) 3: 1098-1104(Aug 1970).","",""
